{
  "schema_version": "0.1",
  "id": "bluesonoff",
  "name": "Sonoff Basic relay (soffit outlets)",
  "description": "Sonoff Basic (ESP-01S, 1MB flash). Single GPIO button (boot strap pin) toggles a single GPIO relay. Status LED on GPIO13.",
  "created_at": "2020-12-01T00:00:00Z",
  "updated_at": "2026-05-04T00:00:00Z",

  "board": {
    "library_id": "esp01_1m",
    "mcu": "esp8266",
    "framework": "arduino"
  },

  "power": {
    "supply": "mains-via-onboard-psu",
    "rail_voltage_v": 3.3,
    "regulator": "onboard-buck",
    "budget_ma": 250
  },

  "requirements": [
    { "id": "r1", "kind": "capability", "text": "expose mains relay as a switch in HA" },
    { "id": "r2", "kind": "capability", "text": "front button toggles the relay locally" },
    { "id": "r3", "kind": "capability", "text": "status LED reflects ESPHome health" }
  ],

  "components": [
    {
      "id": "front_button", "library_id": "gpio_input", "label": "Soffit Outlet Switch",
      "params": {
        "on_press": [ { "switch.toggle": "soffitoutlets" } ]
      }
    },
    {
      "id": "soffitoutlets", "library_id": "gpio_output", "label": "Soffit Outlets",
      "params": { "restore_mode": "ALWAYS_ON" }
    }
  ],

  "buses": [],

  "connections": [
    { "component_id": "front_button",  "pin_role": "IN",  "target": { "kind": "gpio", "pin": "GPIO0"  } },
    { "component_id": "soffitoutlets", "pin_role": "OUT", "target": { "kind": "gpio", "pin": "GPIO12" } }
  ],

  "passives": [],

  "warnings": [
    { "level": "warn", "code": "strap_pin_used_as_button",
      "text": "GPIO0 is a strap pin (must be HIGH at boot to enter normal mode). Sonoff Basic ties it through the front button to 3V3 with a pull-up; pressing the button at boot WILL force flash mode. Acceptable on a deployed device, but not flexible." },
    { "level": "info", "code": "status_led_in_extras",
      "text": "ESPHome's status_led is a singleton platform with no library entry yet -- lives in esphome_extras." }
  ],

  "esphome_extras": {
    "logger": {},
    "time": [
      { "platform": "homeassistant", "id": "homeassistant_time" }
    ],
    "switch": [
      { "platform": "restart", "name": "bluesonoff Restart" }
    ],
    "status_led": { "pin": { "number": "GPIO13", "inverted": true } }
  },

  "fleet": {
    "device_name": "bluesonoff",
    "tags": ["outdoor", "lighting"],
    "secrets_ref": {
      "wifi_ssid": "!secret wifi_ssid",
      "wifi_password": "!secret wifi_password",
      "api_key": "!secret api_key"
    }
  }
}
