{
  "schema_version": "0.1",
  "id": "ttgo-lora32",
  "name": "TTGO LoRa32 V1 — LoRa node + OLED dashboard",
  "description": "ESP32 TTGO LoRa32 V1 board. Onboard SX1276 LoRa radio on the dedicated SPI bus, onboard SSD1306 OLED on I2C, battery voltage on GPIO35, and a template button that transmits an example LoRa packet.",
  "created_at": "2023-08-01T00:00:00Z",
  "updated_at": "2026-05-04T00:00:00Z",

  "board": {
    "library_id": "ttgo-lora32-v1",
    "mcu": "esp32",
    "framework": "esp-idf"
  },

  "power": {
    "supply": "usb-5v",
    "rail_voltage_v": 5.0,
    "regulator": "onboard-ams1117",
    "budget_ma": 500
  },

  "requirements": [
    { "id": "r1", "kind": "capability", "text": "transmit and receive 915MHz LoRa packets" },
    { "id": "r2", "kind": "capability", "text": "render status on the onboard OLED" },
    { "id": "r3", "kind": "capability", "text": "publish battery voltage and wifi signal" }
  ],

  "components": [
    {
      "id": "lora", "library_id": "sx127x", "label": "LoRa Radio", "role": "radio",
      "params": {
        "frequency": 915000000,
        "modulation": "LORA",
        "bandwidth": "125_0kHz",
        "spreading_factor": 7,
        "coding_rate": "CR_4_6",
        "preamble_size": 8,
        "sync_value": 18,
        "crc_enable": true,
        "pa_pin": "BOOST",
        "pa_power": 10,
        "rx_start": true,
        "on_packet": {
          "then": [
            { "lambda": "!lambda ESP_LOGD(\"lora\", \"Received packet RSSI: %.2f dBm, SNR: %.2f dB, Data: %s\", rssi, snr, format_hex(x).c_str());" }
          ]
        }
      }
    },
    {
      "id": "screen", "library_id": "ssd1306", "label": "TTGO OLED", "role": "display",
      "params": {
        "address": "0x3C",
        "lambda_": "it.printf(0, 0, id(display_font), \"T3 LoRa32\");\nit.printf(0, 16, id(display_font), \"V1.6.1\");\nit.printf(0, 32, id(display_font), \"%.1f dBm\", id(wifi_signal_db).state);\n"
      }
    }
  ],

  "buses": [
    { "id": "spi0", "type": "spi", "clk": "GPIO5",  "miso": "GPIO19", "mosi": "GPIO27" },
    { "id": "i2c0", "type": "i2c", "frequency_hz": 400000, "sda": "GPIO21", "scl": "GPIO22" }
  ],

  "connections": [
    { "component_id": "lora", "pin_role": "VCC",  "target": { "kind": "rail", "rail": "3V3" } },
    { "component_id": "lora", "pin_role": "GND",  "target": { "kind": "rail", "rail": "GND" } },
    { "component_id": "lora", "pin_role": "SCK",  "target": { "kind": "bus",  "bus_id": "spi0" } },
    { "component_id": "lora", "pin_role": "MISO", "target": { "kind": "bus",  "bus_id": "spi0" } },
    { "component_id": "lora", "pin_role": "MOSI", "target": { "kind": "bus",  "bus_id": "spi0" } },
    { "component_id": "lora", "pin_role": "CS",   "target": { "kind": "gpio", "pin":   "GPIO18" } },
    { "component_id": "lora", "pin_role": "RST",  "target": { "kind": "gpio", "pin":   "GPIO23" } },
    { "component_id": "lora", "pin_role": "DIO0", "target": { "kind": "gpio", "pin":   "GPIO26" } },

    { "component_id": "screen", "pin_role": "VCC", "target": { "kind": "rail", "rail": "3V3" } },
    { "component_id": "screen", "pin_role": "GND", "target": { "kind": "rail", "rail": "GND" } },
    { "component_id": "screen", "pin_role": "SDA", "target": { "kind": "bus",  "bus_id": "i2c0" } },
    { "component_id": "screen", "pin_role": "SCL", "target": { "kind": "bus",  "bus_id": "i2c0" } }
  ],

  "passives": [
    { "id": "c1", "kind": "capacitor", "value": "10uF",
      "between": ["lora.VCC", "GND"], "purpose": "bulk decoupling LoRa TX bursts" },
    { "id": "c2", "kind": "capacitor", "value": "100nF",
      "between": ["screen.VCC", "GND"], "purpose": "decoupling oled" }
  ],

  "warnings": [
    { "level": "info", "code": "battery_adc_in_extras",
      "text": "Battery ADC sensor + wifi_signal sensor + font + send-packet template button live in esphome_extras." },
    { "level": "warn", "code": "regional_frequency",
      "text": "Frequency 915MHz is legal in US/AU/SG; EU should use 868MHz, JP 923MHz. Verify before deploying." }
  ],

  "esphome_extras": {
    "logger": {},
    "time": [
      { "platform": "homeassistant", "id": "homeassistant_time" }
    ],
    "switch": [
      { "platform": "restart", "name": "TTGO LoRa32 Restart", "id": "reboot" }
    ],
    "button": [
      {
        "platform": "template",
        "name": "Send LoRa Packet",
        "on_press": {
          "then": [
            { "sx127x.send_packet": { "data": [222, 173, 190, 239, 202, 254, 186, 190] } }
          ]
        }
      }
    ],
    "font": [
      { "file": "gfonts://Roboto", "id": "display_font", "size": 14 }
    ],
    "sensor": [
      { "platform": "wifi_signal", "id": "wifi_signal_db", "name": "WiFi Signal", "update_interval": "60s" },
      {
        "platform": "adc", "pin": "GPIO35",
        "name": "Battery Voltage", "attenuation": "12db",
        "filters": [ { "multiply": 2.0 } ],
        "update_interval": "60s"
      }
    ]
  },

  "fleet": {
    "device_name": "ttgo-lora32",
    "tags": ["lora", "outdoor"],
    "secrets_ref": {
      "wifi_ssid": "!secret wifi_ssid",
      "wifi_password": "!secret wifi_password",
      "api_key": "!secret api_key"
    }
  }
}
