{
  "schema_version": "0.1",
  "id": "desk-climate",
  "name": "Desk climate (Sensirion)",
  "description": "ESP32-C3-DevKitM-1 with a Sensirion SHT3x temperature/humidity sensor. Demonstrates the modern precision-sensor option (vs the AHT20 budget pick in room-climate.json).",
  "created_at": "2026-05-05T00:00:00Z",
  "updated_at": "2026-05-05T00:00:00Z",

  "board": {
    "library_id": "esp32-c3-devkitm-1",
    "mcu": "esp32",
    "framework": "arduino"
  },

  "power": {
    "supply": "usb-5v",
    "rail_voltage_v": 5.0,
    "regulator": "onboard-ams1117",
    "budget_ma": 500
  },

  "requirements": [
    { "id": "r1", "kind": "capability",  "text": "publish desk temperature + humidity at 30s intervals" },
    { "id": "r2", "kind": "capability",  "text": "use precision-grade sensing (Sensirion ±0.3°C / ±2% RH)" }
  ],

  "components": [
    {
      "id": "th1",
      "library_id": "sht3xd",
      "label": "Desk climate",
      "params": { "address": "0x44", "update_interval": "30s" }
    }
  ],

  "buses": [
    { "id": "i2c0", "type": "i2c", "frequency_hz": 100000, "sda": "GPIO8", "scl": "GPIO9" }
  ],

  "connections": [
    { "component_id": "th1", "pin_role": "VCC", "target": { "kind": "rail", "rail": "3V3" } },
    { "component_id": "th1", "pin_role": "GND", "target": { "kind": "rail", "rail": "GND" } },
    { "component_id": "th1", "pin_role": "SDA", "target": { "kind": "bus",  "bus_id": "i2c0" } },
    { "component_id": "th1", "pin_role": "SCL", "target": { "kind": "bus",  "bus_id": "i2c0" } }
  ],

  "passives": [
    { "id": "c1", "kind": "capacitor", "value": "100nF", "between": ["th1.VCC", "GND"], "purpose": "decoupling th1" },
    { "id": "r1", "kind": "resistor",  "value": "4.7k",  "between": ["i2c0.SDA", "3V3"], "purpose": "I2C pull-up" },
    { "id": "r2", "kind": "resistor",  "value": "4.7k",  "between": ["i2c0.SCL", "3V3"], "purpose": "I2C pull-up" }
  ],

  "warnings": [],

  "esphome_extras": {
    "captive_portal": {},
    "logger": {}
  },

  "fleet": {
    "device_name": "desk-climate",
    "tags": ["indoor", "climate", "esp32-c3"],
    "secrets_ref": {
      "wifi_ssid": "!secret wifi_ssid",
      "wifi_password": "!secret wifi_password",
      "api_key": "!secret api_key"
    }
  }
}
