{
  "schema_version": "0.1",
  "id": "garage-motion-v1",
  "name": "Garage motion sensor",
  "description": "Outdoor PIR + temp/humidity, USB powered.",
  "created_at": "2026-05-03T12:00:00Z",
  "updated_at": "2026-05-03T12:34:00Z",

  "board": {
    "library_id": "esp32-devkitc-v4",
    "mcu": "esp32",
    "framework": "arduino",
    "pinned_esphome_version": "2024.10.0"
  },

  "power": {
    "supply": "usb-5v",
    "rail_voltage_v": 5.0,
    "regulator": "onboard-ams1117",
    "budget_ma": 500
  },

  "requirements": [
    { "id": "r1", "kind": "capability",  "text": "detect motion at front door" },
    { "id": "r2", "kind": "environment", "text": "outdoor, covered" },
    { "id": "r3", "kind": "constraint",  "text": "USB powered" }
  ],

  "components": [
    {
      "id": "pir1",
      "library_id": "hc-sr501",
      "label": "Driveway PIR",
      "role": "motion_sensor",
      "params": { "retrigger": "H", "pulse_ms": 2500 }
    },
    {
      "id": "bme1",
      "library_id": "bme280",
      "label": "Porch climate",
      "params": { "address": "0x76" }
    }
  ],

  "buses": [
    {
      "id": "i2c0",
      "type": "i2c",
      "frequency_hz": 100000,
      "sda": "GPIO21",
      "scl": "GPIO22"
    }
  ],

  "connections": [
    { "component_id": "pir1", "pin_role": "VCC", "target": { "kind": "rail", "rail": "5V" } },
    { "component_id": "pir1", "pin_role": "GND", "target": { "kind": "rail", "rail": "GND" } },
    { "component_id": "pir1", "pin_role": "OUT", "target": { "kind": "gpio", "pin": "GPIO13" } },
    { "component_id": "bme1", "pin_role": "VCC", "target": { "kind": "rail", "rail": "3V3" } },
    { "component_id": "bme1", "pin_role": "GND", "target": { "kind": "rail", "rail": "GND" } },
    { "component_id": "bme1", "pin_role": "SDA", "target": { "kind": "bus", "bus_id": "i2c0" } },
    { "component_id": "bme1", "pin_role": "SCL", "target": { "kind": "bus", "bus_id": "i2c0" } }
  ],

  "passives": [
    { "id": "c1", "kind": "capacitor", "value": "100nF",
      "between": ["bme1.VCC", "GND"], "purpose": "decoupling bme1" },
    { "id": "r1", "kind": "resistor",  "value": "4.7k",
      "between": ["i2c0.SDA", "3V3"],  "purpose": "I2C pull-up" },
    { "id": "r2", "kind": "resistor",  "value": "4.7k",
      "between": ["i2c0.SCL", "3V3"],  "purpose": "I2C pull-up" }
  ],

  "warnings": [],

  "esphome_extras": {
    "captive_portal": {},
    "logger": { "level": "INFO" }
  },

  "fleet": {
    "device_name": "garage-motion",
    "tags": ["outdoor", "porch"],
    "secrets_ref": {
      "wifi_ssid": "!secret wifi_ssid",
      "wifi_password": "!secret wifi_password",
      "api_key": "!secret api_key"
    }
  }
}
